{
  "$schema": "http://json-schema.org/draft-07/schema#",
  "$id": "https://ai-crew-kit.dev/schemas/backlog.schema.json",
  "title": "AI Crew Kit Backlog",
  "description": "백로그 상태 스키마 - crew-init이 생성하고 각 스킬이 참조/갱신",
  "type": "object",
  "required": ["metadata", "tasks"],
  "properties": {
    "metadata": {
      "type": "object",
      "required": ["lastTaskNumber", "version", "createdAt", "updatedAt"],
      "properties": {
        "lastTaskNumber": {
          "type": "integer",
          "minimum": 0,
          "description": "마지막으로 생성된 Task 번호"
        },
        "projectPrefix": {
          "type": "string",
          "pattern": "^[A-Z][A-Z0-9-]*$",
          "default": "TASK",
          "description": "Task ID 접두사"
        },
        "version": {
          "type": "integer",
          "minimum": 1,
          "description": "낙관적 동시성 제어용 버전 카운터. 모든 쓰기 시 1 증가."
        },
        "createdAt": {
          "type": "string",
          "format": "date-time",
          "description": "백로그 생성 시각"
        },
        "updatedAt": {
          "type": "string",
          "format": "date-time",
          "description": "마지막 갱신 시각"
        }
      },
      "additionalProperties": false
    },
    "summary": {
      "type": "object",
      "description": "백로그 요약 통계 (캐시용, 선택적)",
      "properties": {
        "total": { "type": "integer", "minimum": 0 },
        "done": { "type": "integer", "minimum": 0 },
        "inProgress": { "type": "integer", "minimum": 0 },
        "review": { "type": "integer", "minimum": 0 },
        "todo": { "type": "integer", "minimum": 0 }
      },
      "additionalProperties": false
    },
    "phases": {
      "type": "object",
      "description": "Phase 정의 (key: phase 번호)",
      "additionalProperties": {
        "type": "object",
        "required": ["name", "status"],
        "properties": {
          "name": { "type": "string", "description": "Phase 이름" },
          "description": { "type": "string", "description": "Phase 설명" },
          "status": {
            "type": "string",
            "enum": ["todo", "in_progress", "done"],
            "default": "todo",
            "description": "Phase 상태 — 소속 Task 기준 자동 갱신"
          }
        },
        "additionalProperties": false
      }
    },
    "tasks": {
      "type": "object",
      "description": "Task 맵 (key: Task ID, 예: TASK-001)",
      "additionalProperties": {
        "$ref": "#/definitions/task"
      }
    }
  },
  "additionalProperties": false,
  "definitions": {
    "task": {
      "type": "object",
      "required": ["id", "title", "status", "priority", "createdAt"],
      "properties": {
        "id": {
          "type": "string",
          "pattern": "^[A-Z][A-Z0-9-]*-\\d+$",
          "description": "Task 고유 식별자 (예: TASK-001)"
        },
        "title": {
          "type": "string",
          "minLength": 1,
          "maxLength": 200,
          "description": "Task 제목"
        },
        "description": {
          "type": "string",
          "description": "Task 상세 설명"
        },
        "status": {
          "type": "string",
          "enum": ["todo", "in_progress", "done", "blocked", "paused", "archived"],
          "description": "Task 상태"
        },
        "type": {
          "type": "string",
          "enum": ["feature", "bug", "chore", "spike"],
          "default": "feature",
          "description": "Task 유형 (미지정 시 feature)"
        },
        "priority": {
          "type": "string",
          "enum": ["critical", "high", "medium", "low"],
          "description": "우선순위"
        },
        "phase": {
          "type": "integer",
          "minimum": 1,
          "description": "소속 Phase 번호"
        },
        "assignee": {
          "type": ["string", "null"],
          "description": "담당자 식별자 — Task가 처음 할당된 세션/사용자 (형식: user@hostname-YYYYMMDD-HHmmss). **불변**: 할당 시점에 1회 설정, 이후 해제 전까지 변경 안 됨. 가변 잠금 보유자는 `lockedBy` 참조."
        },
        "assignedAt": {
          "type": ["string", "null"],
          "format": "date-time",
          "description": "할당 시각 — assignee가 처음 설정된 시각. **불변**: 할당 시점에 1회 기록, 만료/해제 시점은 별도(`lockedAt` 기반 TTL)."
        },
        "lockedBy": {
          "type": ["string", "null"],
          "description": "현재 잠금 보유 세션 식별자 — heartbeat 갱신 주체. **가변**: 다른 세션이 lock을 인수하거나 stop.sh 만료 해제 시 null. assignee와 의미 분리(동일 값일 수 있으나 라이프사이클 다름). v2.2.0 도입 (PostToolUse heartbeat / Stop 만료 해제 hook이 직접 참조)."
        },
        "lockedAt": {
          "type": ["string", "null"],
          "format": "date-time",
          "description": "마지막 heartbeat 시각 — PostToolUse hook이 Edit/Write마다 갱신. **가변**: Stop hook이 10분(EXPIRY_SECONDS) 초과 시 null로 해제하여 lock 강제 회수. assignedAt(불변)과 의미 구분. v2.2.0 도입."
        },
        "lockTTL": {
          "type": ["integer", "null"],
          "minimum": 3600,
          "maximum": 14400,
          "default": 3600,
          "description": "잠금 만료 시간(초). lockedFiles 수 기반 동적 산정: ≤3→3600, 4~8→7200, ≥9→10800. --extend-lock 시 +3600 (최대 14400)"
        },
        "lockedFiles": {
          "type": "array",
          "items": { "type": "string" },
          "description": "현재 잠긴 파일 경로 목록"
        },
        "specFile": {
          "type": "string",
          "description": "요구사항 명세 파일 경로"
        },
        "dependencies": {
          "type": "array",
          "items": { "type": "string" },
          "description": "의존하는 Task ID 목록"
        },
        "steps": {
          "type": "array",
          "items": { "$ref": "#/definitions/step" },
          "description": "구현 스텝 목록"
        },
        "currentStep": {
          "type": "integer",
          "minimum": 1,
          "description": "현재 진행 중인 스텝 번호"
        },
        "workflowState": {
          "oneOf": [
            { "$ref": "#/definitions/workflowState" },
            { "type": "null" }
          ],
          "description": "워크플로우 체이닝 상태 (세션 복구용)"
        },
        "createdAt": {
          "type": "string",
          "format": "date-time",
          "description": "Task 생성 시각"
        },
        "updatedAt": {
          "type": "string",
          "format": "date-time",
          "description": "Task 마지막 갱신 시각"
        },
        "completedAt": {
          "type": ["string", "null"],
          "format": "date-time",
          "description": "Task 완료 시각"
        },
        "micro": {
          "type": "boolean",
          "default": false,
          "description": "Micro Task 여부 (crew-impl --micro로 생성)"
        },
        "pauseReason": {
          "type": ["string", "null"],
          "maxLength": 200,
          "description": "일시정지 사유 (status가 paused일 때만 유효)"
        },
        "pausedAt": {
          "type": ["string", "null"],
          "format": "date-time",
          "description": "일시정지 시각"
        }
      },
      "additionalProperties": false
    },
    "step": {
      "type": "object",
      "required": ["number", "title", "status"],
      "properties": {
        "number": {
          "type": "integer",
          "minimum": 1,
          "description": "스텝 번호"
        },
        "title": {
          "type": "string",
          "description": "스텝 제목"
        },
        "description": {
          "type": "string",
          "description": "스텝 상세 설명 (선택). crew-plan/crew-impl이 컨텍스트 힌트로 활용."
        },
        "status": {
          "type": "string",
          "enum": ["pending", "in_progress", "pr_created", "merged", "done", "skipped"],
          "description": "스텝 상태"
        },
        "files": {
          "type": "array",
          "items": { "type": "string" },
          "description": "스텝에서 수정하는 파일 목록"
        },
        "estimatedLines": {
          "type": "integer",
          "minimum": 1,
          "description": "예상 변경 라인 수 (선택, v1 호환 — crew-plan 추정용)."
        },
        "prLineLimit": {
          "type": "integer",
          "minimum": 50,
          "maximum": 1000,
          "description": "스텝별 PR 라인 제한 (미설정 시 project.json conventions.prLineLimit 폴백)"
        },
        "prNumber": {
          "type": ["integer", "null"],
          "description": "생성된 PR 번호"
        },
        "mergedAt": {
          "type": ["string", "null"],
          "format": "date-time",
          "description": "PR 머지 시각"
        }
      },
      "additionalProperties": false
    },
    "workflowState": {
      "type": "object",
      "required": ["currentSkill", "updatedAt"],
      "properties": {
        "currentSkill": {
          "type": "string",
          "enum": ["crew-plan", "crew-impl", "crew-review-pr", "crew-fix", "crew-merge-pr", "crew-hotfix", "crew-rollback", "crew-retro", "skill-plan", "skill-impl", "skill-review-pr", "skill-fix", "skill-merge-pr", "skill-hotfix", "skill-rollback", "skill-retro"],
          "description": "현재 실행 중인 스킬. crew-* 가 정식 값. v4.0.0 업그레이드 직전 in-flight backlog.json에 남아있을 수 있는 구 skill-* 값도 하위호환으로 허용(backlog.json은 업그레이드가 무변환 보존하므로 — 다음 워크플로 진행 시 crew-* 로 자가 갱신)."
        },
        "lastCompletedSkill": {
          "type": ["string", "null"],
          "description": "마지막으로 완료된 스킬"
        },
        "prNumber": {
          "type": ["integer", "null"],
          "description": "현재 관련 PR 번호"
        },
        "autoChainArgs": {
          "type": "string",
          "description": "자동 체이닝에 전달할 인수"
        },
        "fixLoopCount": {
          "type": ["integer", "null"],
          "minimum": 0,
          "maximum": 2,
          "description": "같은 PR에 대한 crew-fix 호출 횟수 (루프 가드: 최대 2회)"
        },
        "lastReviewDecision": {
          "type": ["string", "null"],
          "enum": ["APPROVED", "COMMENT", "REQUEST_CHANGES", null],
          "description": "직전 crew-review-pr 회차의 결정값. crew-review-pr Step 6.5가 매 리뷰마다 갱신. crew-fix 모드 판정 SSOT(auto-fix vs 수동) 및 PreToolUse 머지 게이트(pre-tool-use.sh)의 결정적 신호. REQUEST_CHANGES = 미해결 CRITICAL 게시됨 → 머지 차단 대상. v2.4.0 도입(이전엔 스킬이 참조했으나 schema 미등록으로 additionalProperties:false에 거부되던 sleeper)."
        },
        "updatedAt": {
          "type": "string",
          "format": "date-time",
          "description": "워크플로우 상태 마지막 갱신 시각"
        }
      },
      "additionalProperties": false
    }
  }
}
