{
  "metadata": {
    "lastTaskNumber": 2,
    "projectPrefix": "TASK",
    "version": 1,
    "createdAt": "2026-06-06T00:00:00Z",
    "updatedAt": "2026-06-06T00:00:00Z"
  },
  "summary": {
    "total": 2,
    "done": 0,
    "inProgress": 0,
    "review": 0,
    "todo": 2
  },
  "phases": {
    "1": {
      "name": "핵심 기능",
      "description": "리소스 CRUD + 인증",
      "status": "todo"
    }
  },
  "tasks": {
    "TASK-001": {
      "id": "TASK-001",
      "title": "사용자 인증 API",
      "description": "JWT 발급/검증 기반 로그인·로그아웃 API 구현.",
      "status": "todo",
      "priority": "high",
      "phase": 1,
      "dependencies": [],
      "specFile": "docs/requirements/TASK-001-spec.md",
      "createdAt": "2026-06-06T00:00:00Z"
    },
    "TASK-002": {
      "id": "TASK-002",
      "title": "리소스 CRUD API",
      "description": "핵심 리소스 생성/조회/수정/삭제 + 페이지네이션.",
      "status": "todo",
      "priority": "medium",
      "phase": 1,
      "dependencies": ["TASK-001"],
      "specFile": "docs/requirements/TASK-002-spec.md",
      "createdAt": "2026-06-06T00:00:00Z"
    }
  }
}
