{
  "metadata": {
    "lastTaskNumber": 2,
    "projectPrefix": "GEN",
    "version": 1,
    "createdAt": "2026-02-15T00:00:00Z",
    "updatedAt": "2026-02-15T00:00:00Z"
  },
  "summary": {
    "total": 2,
    "done": 0,
    "inProgress": 0,
    "review": 0,
    "todo": 2
  },
  "phases": {
    "PHASE-1": {
      "name": "핵심 기능",
      "description": "리소스 CRUD + 처리 흐름",
      "status": "todo"
    }
  },
  "tasks": {
    "GEN-001": {
      "id": "GEN-001",
      "title": "리소스 카탈로그 API",
      "description": "리소스 CRUD API 구현. 검색, 페이지네이션 포함.",
      "status": "todo",
      "priority": "high",
      "phase": 1,
      "dependencies": [],
      "specFile": "docs/requirements/GEN-001-spec.md",
      "createdAt": "2026-02-15T00:00:00Z"
    },
    "GEN-002": {
      "id": "GEN-002",
      "title": "처리 시스템",
      "description": "요청 생성, 상태 관리(상태 머신), 후처리.",
      "status": "todo",
      "priority": "high",
      "phase": 1,
      "dependencies": ["GEN-001"],
      "specFile": "docs/requirements/GEN-002-spec.md",
      "createdAt": "2026-02-15T00:00:00Z",
      "steps": [
        {
          "number": 1,
          "title": "상태 머신 정의",
          "description": "요청 상태 전이 규칙과 불변식 정의",
          "estimatedLines": 180,
          "status": "pending"
        },
        {
          "number": 2,
          "title": "처리 API 구현",
          "description": "생성/조회/상태변경 엔드포인트",
          "estimatedLines": 240,
          "status": "pending"
        }
      ]
    }
  }
}
